{
  "$schema": "http://json-schema.org/draft-07/schema#",
  "$id": "shokunin/ship.config.schema.json",
  "title": "Shokunin Ship Manifest",
  "description": "Single source of truth for a project's CI/CD pipeline (pcdev -> forge). Locked after ship-gateway elicitation; changes require an ADR. Validated by scripts/check-ship-config.mjs.",
  "type": "object",
  "additionalProperties": false,
  "required": ["schemaVersion", "shape", "config", "forge", "packageManager", "versioning", "registry", "services", "gates"],
  "properties": {
    "schemaVersion": { "const": "1.0" },
    "shape": { "enum": ["monolith", "monorepo"] },
    "config": { "enum": ["frontend", "backend", "fullstack"] },
    "forge": { "enum": ["github", "gitlab"] },
    "packageManager": { "const": "pnpm" },
    "versioning": {
      "const": "changesets",
      "description": "Locked decision D1: changesets for every project shape, monolith included."
    },
    "registry": {
      "type": "object",
      "additionalProperties": false,
      "required": ["provider", "visibility"],
      "properties": {
        "provider": { "enum": ["ghcr", "gitlab", "custom"] },
        "url": {
          "type": "string",
          "minLength": 1,
          "description": "Required when provider=custom. For ghcr/gitlab, derived from forge variables if omitted."
        },
        "visibility": { "enum": ["public", "private"] }
      }
    },
    "sharedPaths": {
      "type": "array",
      "items": { "type": "string", "minLength": 1 },
      "description": "Paths whose change impacts ALL services (blast radius). Empty for monolith.",
      "default": []
    },
    "services": {
      "type": "object",
      "minProperties": 1,
      "description": "Monolith: exactly one entry (conventionally 'app' with path '.'). Monorepo: one entry per deployable service.",
      "additionalProperties": false,
      "patternProperties": {
        "^[a-z][a-z0-9-]*$": {
          "type": "object",
          "additionalProperties": false,
          "required": ["path", "framework", "type"],
          "properties": {
            "path": { "type": "string", "minLength": 1, "description": "Relative path from repo root. '.' for monolith." },
            "framework": { "enum": ["nest", "nuxt", "mastra", "astro", "node-lib"] },
            "type": { "enum": ["api", "web", "worker", "docs"] },
            "package": {
              "type": "boolean",
              "default": true,
              "description": "false = this service is built but never dockerized (e.g. node-lib)."
            }
          }
        }
      }
    },
    "gates": {
      "type": "object",
      "additionalProperties": false,
      "required": ["structure", "lint", "typecheck", "unit", "coverageMin", "e2e", "package"],
      "properties": {
        "structure": { "const": true, "description": "check-shokunin-structure --strict. Never disabled (D5: guard is blocking)." },
        "lint": { "const": true },
        "typecheck": { "const": true },
        "unit": { "const": true },
        "integration": { "type": "boolean", "default": true },
        "coverageMin": {
          "type": "object",
          "additionalProperties": false,
          "required": ["lines"],
          "properties": {
            "lines": { "type": "number", "minimum": 0, "maximum": 100 },
            "functions": { "type": "number", "minimum": 0, "maximum": 100 }
          },
          "description": "Replaces the hardcoded 75/80 thresholds of the legacy pipelines."
        },
        "e2e": { "enum": ["on_mr", "nightly", "off"], "description": "Locked decision D2: on_mr (L), nightly (M), off (S)." },
        "package": { "type": "boolean", "description": "false in profile S: build artifact is enough, no docker stage." },
        "docs": { "type": "boolean", "default": false, "description": "Locked decision Q2: docs job triggered by tag, human-enabled here. S: false. M: build. L: build+publish (delivery gate)." }
      }
    }
  }
}
